{
  "schema": "strategy-readiness-audit/2",
  "version": 2,
  "generated_at": "2026-08-30T16:35:16.298Z",
  "basis": "EVIDENCE_DERIVED_OPERATIONAL",
  "dimensions": [
    {
      "id": "governance",
      "title": "Research governance and reproducibility",
      "capability": {
        "score": 0,
        "earned": 0,
        "total": 2,
        "checks": [
          {
            "id": "governance.run-schema",
            "description": "exact authoritative run schema",
            "points": 1,
            "passed": false,
            "evidence": []
          },
          {
            "id": "governance.run-hash",
            "description": "run content and byte hashes verified",
            "points": 1,
            "passed": false,
            "evidence": []
          }
        ]
      },
      "operational": {
        "score": 0,
        "earned": 0,
        "total": 2,
        "checks": [
          {
            "id": "governance.immutable-lineage",
            "description": "run has complete immutable lineage",
            "points": 1,
            "passed": false,
            "evidence": []
          },
          {
            "id": "governance.authoritative",
            "description": "authoritative provenance is declared",
            "points": 1,
            "passed": false,
            "evidence": []
          }
        ]
      },
      "score": 0,
      "status": "BLOCKED",
      "blockers": [
        "governance.run-schema",
        "governance.run-hash",
        "governance.immutable-lineage",
        "governance.authoritative"
      ]
    },
    {
      "id": "statistical",
      "title": "Statistical selection controls",
      "capability": {
        "score": 0,
        "earned": 0,
        "total": 2,
        "checks": [
          {
            "id": "statistical.wfo-schema",
            "description": "exact eight-fold WFO artifact",
            "points": 1,
            "passed": false,
            "evidence": []
          },
          {
            "id": "statistical.overfit-schema",
            "description": "exact fail-closed overfit artifact",
            "points": 1,
            "passed": false,
            "evidence": []
          }
        ]
      },
      "operational": {
        "score": 0,
        "earned": 0,
        "total": 2,
        "checks": [
          {
            "id": "statistical.purged-embargoed",
            "description": "30-day purge and seven-day embargo",
            "points": 1,
            "passed": false,
            "evidence": []
          },
          {
            "id": "statistical.lineage-bound",
            "description": "WFO binds immutable dataset/precommit/experiment lineage",
            "points": 1,
            "passed": false,
            "evidence": []
          }
        ]
      },
      "score": 0,
      "status": "BLOCKED",
      "blockers": [
        "statistical.wfo-schema",
        "statistical.overfit-schema",
        "statistical.purged-embargoed",
        "statistical.lineage-bound"
      ]
    },
    {
      "id": "pit",
      "title": "PIT historical data readiness",
      "capability": {
        "score": 0,
        "earned": 0,
        "total": 2,
        "checks": [
          {
            "id": "pit.authoritative-schema",
            "description": "authoritative separated v5 Parquet artifact set",
            "points": 1,
            "passed": false,
            "evidence": []
          },
          {
            "id": "pit.physical-hashes",
            "description": "feature/label/execution/mark files are hash-bound",
            "points": 1,
            "passed": false,
            "evidence": []
          }
        ]
      },
      "operational": {
        "score": 0,
        "earned": 0,
        "total": 2,
        "checks": [
          {
            "id": "pit.availability-contract",
            "description": "label and execution artifacts preserve availability boundaries",
            "points": 1,
            "passed": false,
            "evidence": []
          },
          {
            "id": "pit.no-staging-substitute",
            "description": "no staging artifact is accepted as authoritative",
            "points": 1,
            "passed": false,
            "evidence": []
          }
        ]
      },
      "score": 0,
      "status": "BLOCKED",
      "blockers": [
        "pit.authoritative-schema",
        "pit.physical-hashes",
        "pit.availability-contract",
        "pit.no-staging-substitute"
      ]
    },
    {
      "id": "opportunity",
      "title": "Frozen opportunity domain and physical hydration",
      "capability": {
        "score": 0,
        "earned": 0,
        "total": 2,
        "checks": [
          {
            "id": "opportunity.feature-contract-lineage",
            "description": "feature DAG and plan are physically reopened and hash-linked",
            "points": 1,
            "passed": false,
            "evidence": []
          },
          {
            "id": "opportunity.v2-contracts",
            "description": "complete non-fixture domain, envelope and hydration v2 artifacts are present",
            "points": 1,
            "passed": false,
            "evidence": []
          }
        ]
      },
      "operational": {
        "score": 0,
        "earned": 0,
        "total": 2,
        "checks": [
          {
            "id": "opportunity.physical-chain",
            "description": "v2 hydration reopens its physical v1 partition source and complete coverage",
            "points": 1,
            "passed": false,
            "evidence": []
          },
          {
            "id": "opportunity.run-lineage",
            "description": "the authoritative run binds the exact frozen v2 envelope",
            "points": 1,
            "passed": false,
            "evidence": []
          }
        ]
      },
      "score": 0,
      "status": "BLOCKED",
      "blockers": [
        "opportunity.feature-contract-lineage",
        "opportunity.v2-contracts",
        "opportunity.physical-chain",
        "opportunity.run-lineage"
      ]
    },
    {
      "id": "execution",
      "title": "Execution realism",
      "capability": {
        "score": 0,
        "earned": 0,
        "total": 2,
        "checks": [
          {
            "id": "execution.authoritative-schema",
            "description": "execution is derived from exact v5 run",
            "points": 1,
            "passed": false,
            "evidence": []
          },
          {
            "id": "execution.physical-rows",
            "description": "execution rows are physically bound",
            "points": 1,
            "passed": false,
            "evidence": []
          }
        ]
      },
      "operational": {
        "score": 0,
        "earned": 0,
        "total": 2,
        "checks": [
          {
            "id": "execution.fill-recompute",
            "description": "fills/trades are recomputed in canonical pipeline",
            "points": 1,
            "passed": false,
            "evidence": []
          },
          {
            "id": "execution.label-separation",
            "description": "execution is separate from signal predicates",
            "points": 1,
            "passed": false,
            "evidence": []
          }
        ]
      },
      "score": 0,
      "status": "BLOCKED",
      "blockers": [
        "execution.authoritative-schema",
        "execution.physical-rows",
        "execution.fill-recompute",
        "execution.label-separation"
      ]
    },
    {
      "id": "portfolio",
      "title": "Portfolio and risk realism",
      "capability": {
        "score": 0,
        "earned": 0,
        "total": 2,
        "checks": [
          {
            "id": "portfolio.authoritative-schema",
            "description": "physical portfolio risk artifact is exact v5 schema",
            "points": 1,
            "passed": false,
            "evidence": []
          },
          {
            "id": "portfolio.physical-mark",
            "description": "portfolio binds a physical mark artifact",
            "points": 1,
            "passed": false,
            "evidence": []
          }
        ]
      },
      "operational": {
        "score": 0,
        "earned": 0,
        "total": 2,
        "checks": [
          {
            "id": "portfolio.pnl-mrc",
            "description": "actual PnL covariance/MRC reconciles",
            "points": 1,
            "passed": false,
            "evidence": []
          },
          {
            "id": "portfolio.separate-decisions",
            "description": "asset and portfolio decisions remain separate",
            "points": 1,
            "passed": false,
            "evidence": []
          }
        ]
      },
      "score": 0,
      "status": "BLOCKED",
      "blockers": [
        "portfolio.authoritative-schema",
        "portfolio.physical-mark",
        "portfolio.pnl-mrc",
        "portfolio.separate-decisions"
      ]
    },
    {
      "id": "prospective",
      "title": "Prospective validation readiness",
      "capability": {
        "score": 0,
        "earned": 0,
        "total": 2,
        "checks": [
          {
            "id": "prospective.publication-schema",
            "description": "portable signed publication schema is exact",
            "points": 1,
            "passed": false,
            "evidence": []
          },
          {
            "id": "prospective.evidence-digests",
            "description": "all publication evidence is hash-bound",
            "points": 1,
            "passed": false,
            "evidence": []
          }
        ]
      },
      "operational": {
        "score": 0,
        "earned": 0,
        "total": 2,
        "checks": [
          {
            "id": "prospective.replay-revocation",
            "description": "replay and revocation heads are recorded",
            "points": 1,
            "passed": false,
            "evidence": []
          },
          {